{
  "version": "1",
  "content_sets": [
    {
      "id": "starter",
      "label": "Starter Demo Content",
	  "url": "https://raw.githubusercontent.com/edgdmedia/reci/main/demo-content/pages.php",
      "description": "Starter import payload for first-time client setup.",
      "groups": [
        "reci_demo_taxonomies",
        "reci_demo_images_reflections",
        "reci_demo_images_articles",
        "reci_demo_images_events",
        "reci_demo_images_courses",
        "reci_demo_images_podcasts",
        "reci_demo_images_videos",
        "reci_demo_images_quizzes",
        "reci_demo_images_partners",
        "post",
        "reci_podcast",
        "reci_video",
        "reci_event",
        "reci_reflection",
        "reci_quote",
        "reci_assessment",
        "reci_course",
        "reci_team",
        "reci_testimonial",
        "reci_glossary_term",
        "reci_author",
        "reci_partner",
        "reci_page"
      ],
      "required_plugins": []
    }
  ],
  "assets": {},
  "pages": [
    "https://raw.githubusercontent.com/edgdmedia/reci/main/demo-content/pages.php"
  ],
  "posts": [
    "https://raw.githubusercontent.com/edgdmedia/reci/main/demo-content/authors.php",
    "https://raw.githubusercontent.com/edgdmedia/reci/main/demo-content/articles/RECMH%20Origin.md",
    "https://raw.githubusercontent.com/edgdmedia/reci/main/demo-content/events.php",
    "https://raw.githubusercontent.com/edgdmedia/reci/main/demo-content/podcasts.php",
    "https://raw.githubusercontent.com/edgdmedia/reci/main/demo-content/videos.php"
  ],
  "taxonomies": [
    "https://raw.githubusercontent.com/edgdmedia/reci/main/demo-content/glossary.php"
  ]
}
